5-Dec<Experience keeps a dear school, but fools will learn in no other.
6-Dec<Slander is the homage which vice pays to virtue.
7-Dec<Every grief has twenty shadows, most of them of you own making.
8-Dec<Evil words cut far worse than swords.
9-Dec<If death be terrible, the fault is not in death, but thee.
10-Dec<If through your carelessness you wife becomes a widow, who will cook for you?
11-Dec<Answer not a fool according to his folly lest thou also be like unto him.
12-Dec<The Great Way is very easy, but all love the by-paths.
13-Dec<To enjoy a lifetime romance --fall in love with yourself.
14-Dec<He that can compose himself, is wiser than he that composes books.
15-Dec<He that would live in peace and at ease, must not speak all he knows, nor judge all he sees.
16-Dec<Don't overload gratitude; if you do, she'll kick.
17-Dec<If you'd have a servant that you'd like, serve yourself.
18-Dec<All things are easy to industry, all thinks difficult to sloth.
19-Dec<Luck perhaps visits the fool, but does not sit down with him.
20-Dec<If you can be well without health, you may be happy without virtue.
21-Dec<Drink does not drown care, but waters it, and makes it grow faster.
22-Dec<If you do what you should not, you must bear what you would not.
23-Dec<Do not be breaking your shin on a stool that is not in your way.
24-Dec<Words may show a man's wit, but actions his meaning.
25-Dec<Cherish now your loved ones dear, for Christmas comes but once a year.
26-Dec<A good word is as soon said as a bad one.
27-Dec<Covetous men's chests are rich, not they.
28-Dec<Fie upon hens quoth the fox, when he could not reach them.
29-Dec<Good words cost nothing, but are worth much
30-Dec<The honey is sweet, but the bee has sting.
31-Dec<Solomon made a book of proverbs, but a book of proverbs never made a Solomon.
